{
  "brand": "Toyota",
  "model": "Corolla",
  "category": "Komfort",
  "filePath": "2-Zonen Klimaautomatik.mp4",
  "imagePath": "2-Zonen Klimaautomatik.jpg",
  "name": "2-Zonen Klimaautomatik",
  "description": "FÃ¼r gute Luft, sorgt die Klimaautomatik.",
  "tags": [
    "Luft", "Zone", "Klima", "Automatisch", "Scheibe", "2"
  ]
}