{
  "brand": "Toyota",
  "model": "CorollaTSGR",
  "category": "Sicherheit",
  "filePath": "Motorhaube entriegelung.mp4",
  "imagePath": "Motorhaube entriegelung.jpg",
  "name": "Motorhaube entriegelung",
  "description": "FÃ¼r gute Luft, sorgt die Klimaautomatik.",
  "tags": [
    "Luft", "Zone", "Klima", "Automatisch", "Scheibe", "2"
  ]
}